{
  "campaign_id": "autonomous-policy-core-v1",
  "status": "experimental",
  "max_iterations": 1,
  "baseline_policy_path": "packages/orchestration/policies/default.autonomous-policy.json",
  "trusted_paths": [
    "evals/schemas/outcome-task-spec.schema.json",
    "evals/schemas/outcome-task-bundle.schema.json",
    "evals/schemas/outcome-report.schema.json",
    "evals/schemas/outcome-comparison.schema.json",
    "evals/scripts/lib/outcome_eval.py",
    "evals/scripts/lib/outcome_comparison.py",
    "evals/scripts/lib/outcome_rae.py",
    "evals/scripts/lib/outcome_resources.py",
    "evals/scripts/lib/policy_optimizer.py",
    "evals/scripts/lib/policy_optimizer_evidence.py",
    "evals/scripts/lib/policy_optimizer_policy.py",
    "evals/scripts/run_outcome_benchmark.py",
    "evals/scripts/compare_outcome_reports.py",
    "evals/scripts/optimize_harness.py",
    "evals/datasets/autonomous-outcomes/core.task-bundle.json",
    "evals/fixtures/autonomous-outcomes/compile-repair/README.md",
    "evals/fixtures/autonomous-outcomes/compile-repair/app.py",
    "evals/fixtures/autonomous-outcomes/compile-repair/tests/test_app.py",
    "evals/fixtures/autonomous-outcomes/logic-regression/README.md",
    "evals/fixtures/autonomous-outcomes/logic-regression/calculator.py",
    "evals/fixtures/autonomous-outcomes/logic-regression/tests/test_calculator.py",
    "evals/fixtures/autonomous-outcomes/scope-stress/README.md",
    "evals/fixtures/autonomous-outcomes/scope-stress/normalizer.py",
    "evals/fixtures/autonomous-outcomes/scope-stress/tests/test_normalizer.py"
  ],
  "resource_budget": {
    "max_agent_duration_seconds": 7200,
    "max_total_tokens": 1000000,
    "max_agent_calls": 80
  }
}
